handle	kind	old_id	new_id	old_path	new_path	title
fisof	DI	DI-019-20260510-111726	DI-fisof	TODO/019-image-owned-go-toolchain.md#DI-019-20260510-111726	TODO/TODO-vimoj-image-owned-go-toolchain.md#DI-fisof	Make decomk-owned bootstrap images responsible for selecting and constraining the Go toolchain, including image-level `GOTOOLCHAIN=local`, while stage0 only consumes the image-provided `go`.
divaf	DI	DI-019-20260510-112226	DI-divaf	TODO/019-image-owned-go-toolchain.md#DI-019-20260510-112226	TODO/TODO-vimoj-image-owned-go-toolchain.md#DI-divaf	Supersede the narrow TODO 018 toolchain-name mitigation with image-owned Go 1.23 package selection and image-level `GOTOOLCHAIN=local`.
fudok	DI	DI-019-20260510-113632	DI-fudok	TODO/019-image-owned-go-toolchain.md#DI-019-20260510-113632	TODO/TODO-vimoj-image-owned-go-toolchain.md#DI-fudok	Use the module directive `go 1.23`, not `go 1.23.0`.
hibav	DI	DI-019-20260510-114103	DI-hibav	TODO/019-image-owned-go-toolchain.md#DI-019-20260510-114103	TODO/TODO-vimoj-image-owned-go-toolchain.md#DI-hibav	Expose the image-owned Go 1.23 toolchain through `/usr/local/bin/go` and `/usr/local/bin/gofmt` symlinks in decomk-owned Dockerfiles.
mogov	DI	DI-019-20260513-221053	DI-mogov	TODO/019-image-owned-go-toolchain.md#DI-019-20260513-221053	TODO/TODO-vimoj-image-owned-go-toolchain.md#DI-mogov	Close TODO 019 as decomk-side provenance only; move ongoing production image toolchain policy ownership to the `decomk-conf-cswg` repo.
